{
  "$schema": "https://json-schema.org/draft/2020-12/schema",
  "type": "object",
  "properties": {
    "version": {
      "type": "string",
      "const": "1"
    },
    "title": {
      "type": "string",
      "minLength": 1,
      "maxLength": 120
    },
    "profile": {
      "type": "string",
      "const": "preview"
    },
    "targetDurationMs": {
      "type": "integer",
      "minimum": 10000,
      "maximum": 600000
    },
    "theme": {
      "type": "string",
      "const": "technical-whiteboard"
    },
    "scenes": {
      "minItems": 3,
      "maxItems": 16,
      "type": "array",
      "items": {
        "type": "object",
        "properties": {
          "id": {
            "type": "string",
            "minLength": 1,
            "maxLength": 64,
            "pattern": "^[a-z0-9][a-z0-9_-]{0,63}$"
          },
          "kind": {
            "type": "string",
            "enum": [
              "title",
              "statement",
              "diagram",
              "comparison",
              "code",
              "outro",
              "bullets",
              "image"
            ]
          },
          "title": {
            "type": "string",
            "minLength": 1,
            "maxLength": 180
          },
          "narration": {
            "minItems": 1,
            "maxItems": 32,
            "type": "array",
            "items": {
              "type": "object",
              "properties": {
                "id": {
                  "type": "string",
                  "minLength": 1,
                  "maxLength": 64,
                  "pattern": "^[a-z0-9][a-z0-9_-]{0,63}$"
                },
                "text": {
                  "type": "string",
                  "minLength": 1,
                  "maxLength": 1600
                },
                "spokenText": {
                  "type": "string",
                  "minLength": 1,
                  "maxLength": 1600
                }
              },
              "required": [
                "id",
                "text"
              ],
              "additionalProperties": false
            }
          },
          "visual": {
            "type": "object",
            "properties": {
              "subtitle": {
                "type": "string",
                "minLength": 1,
                "maxLength": 180
              },
              "lines": {
                "maxItems": 12,
                "type": "array",
                "items": {
                  "type": "string",
                  "minLength": 1,
                  "maxLength": 240
                }
              },
              "nodes": {
                "maxItems": 32,
                "type": "array",
                "items": {
                  "type": "object",
                  "properties": {
                    "id": {
                      "type": "string",
                      "minLength": 1,
                      "maxLength": 64,
                      "pattern": "^[a-z0-9][a-z0-9_-]{0,63}$"
                    },
                    "label": {
                      "type": "string",
                      "minLength": 1,
                      "maxLength": 180
                    }
                  },
                  "required": [
                    "id",
                    "label"
                  ],
                  "additionalProperties": false
                }
              },
              "edges": {
                "maxItems": 64,
                "type": "array",
                "items": {
                  "type": "object",
                  "properties": {
                    "from": {
                      "type": "string",
                      "minLength": 1,
                      "maxLength": 64,
                      "pattern": "^[a-z0-9][a-z0-9_-]{0,63}$"
                    },
                    "to": {
                      "type": "string",
                      "minLength": 1,
                      "maxLength": 64,
                      "pattern": "^[a-z0-9][a-z0-9_-]{0,63}$"
                    }
                  },
                  "required": [
                    "from",
                    "to"
                  ],
                  "additionalProperties": false
                }
              },
              "left": {
                "type": "object",
                "properties": {
                  "title": {
                    "type": "string",
                    "minLength": 1,
                    "maxLength": 180
                  },
                  "lines": {
                    "minItems": 1,
                    "maxItems": 12,
                    "type": "array",
                    "items": {
                      "type": "string",
                      "minLength": 1,
                      "maxLength": 240
                    }
                  }
                },
                "required": [
                  "title",
                  "lines"
                ],
                "additionalProperties": false
              },
              "right": {
                "type": "object",
                "properties": {
                  "title": {
                    "type": "string",
                    "minLength": 1,
                    "maxLength": 180
                  },
                  "lines": {
                    "minItems": 1,
                    "maxItems": 12,
                    "type": "array",
                    "items": {
                      "type": "string",
                      "minLength": 1,
                      "maxLength": 240
                    }
                  }
                },
                "required": [
                  "title",
                  "lines"
                ],
                "additionalProperties": false
              },
              "code": {
                "type": "string",
                "minLength": 1,
                "maxLength": 2400
              },
              "assetId": {
                "type": "string",
                "minLength": 1,
                "maxLength": 64,
                "pattern": "^[a-z0-9][a-z0-9_-]{0,63}$"
              },
              "presenter": {
                "anyOf": [
                  {
                    "type": "object",
                    "properties": {
                      "assetId": {
                        "type": "string",
                        "minLength": 1,
                        "maxLength": 64,
                        "pattern": "^[a-z0-9][a-z0-9_-]{0,63}$"
                      }
                    },
                    "required": [
                      "assetId"
                    ],
                    "additionalProperties": false
                  },
                  {
                    "type": "object",
                    "properties": {
                      "character": {
                        "type": "string",
                        "const": "claudia"
                      },
                      "motion": {
                        "type": "string",
                        "enum": [
                          "full",
                          "reduced"
                        ]
                      }
                    },
                    "required": [
                      "character"
                    ],
                    "additionalProperties": false
                  }
                ]
              }
            },
            "additionalProperties": false
          },
          "cues": {
            "maxItems": 64,
            "type": "array",
            "items": {
              "type": "object",
              "properties": {
                "chunkId": {
                  "type": "string",
                  "minLength": 1,
                  "maxLength": 64,
                  "pattern": "^[a-z0-9][a-z0-9_-]{0,63}$"
                },
                "tokenIndex": {
                  "type": "integer",
                  "minimum": 0,
                  "maximum": 1000
                },
                "action": {
                  "type": "string",
                  "const": "highlight"
                },
                "target": {
                  "type": "string",
                  "minLength": 1,
                  "maxLength": 64,
                  "pattern": "^[a-z0-9][a-z0-9_-]{0,63}$"
                },
                "timingFallback": {
                  "type": "string",
                  "const": "sentence-start"
                }
              },
              "required": [
                "chunkId",
                "tokenIndex",
                "action",
                "target",
                "timingFallback"
              ],
              "additionalProperties": false
            }
          }
        },
        "required": [
          "id",
          "kind",
          "title",
          "narration",
          "visual"
        ],
        "additionalProperties": false
      }
    },
    "assets": {
      "maxItems": 8,
      "type": "array",
      "items": {
        "type": "object",
        "properties": {
          "id": {
            "type": "string",
            "minLength": 1,
            "maxLength": 64,
            "pattern": "^[a-z0-9][a-z0-9_-]{0,63}$"
          },
          "source": {
            "type": "string",
            "minLength": 1,
            "maxLength": 512
          },
          "sha256": {
            "type": "string",
            "pattern": "^[a-f0-9]{64}$"
          },
          "mimeType": {
            "type": "string",
            "enum": [
              "image/png",
              "image/jpeg",
              "image/webp"
            ]
          },
          "provenance": {
            "type": "object",
            "properties": {
              "character": {
                "type": "string",
                "minLength": 1,
                "maxLength": 80
              },
              "origin": {
                "type": "string",
                "enum": [
                  "gallery",
                  "generated",
                  "manual"
                ]
              },
              "sourceUrl": {
                "type": "string",
                "maxLength": 2048,
                "pattern": "^https?:\\/\\/"
              },
              "prompt": {
                "type": "string",
                "minLength": 1,
                "maxLength": 6000
              },
              "identityText": {
                "type": "string",
                "minLength": 1,
                "maxLength": 2000
              },
              "identitySha256": {
                "type": "string",
                "pattern": "^[a-f0-9]{64}$"
              },
              "canonUrl": {
                "type": "string",
                "maxLength": 2048,
                "pattern": "^https?:\\/\\/"
              },
              "canonRetrievedAt": {
                "type": "string",
                "format": "date",
                "pattern": "^(?:(?:\\d\\d[2468][048]|\\d\\d[13579][26]|\\d\\d0[48]|[02468][048]00|[13579][26]00)-02-29|\\d{4}-(?:(?:0[13578]|1[02])-(?:0[1-9]|[12]\\d|3[01])|(?:0[469]|11)-(?:0[1-9]|[12]\\d|30)|(?:02)-(?:0[1-9]|1\\d|2[0-8])))$"
              },
              "credit": {
                "type": "string",
                "minLength": 1,
                "maxLength": 180
              },
              "aiGenerated": {
                "type": "boolean"
              }
            },
            "required": [
              "character",
              "origin",
              "credit",
              "aiGenerated"
            ],
            "additionalProperties": false
          }
        },
        "required": [
          "id",
          "source",
          "sha256",
          "mimeType"
        ],
        "additionalProperties": false
      }
    }
  },
  "required": [
    "version",
    "title",
    "profile",
    "targetDurationMs",
    "theme",
    "scenes"
  ],
  "additionalProperties": false,
  "$comment": "Cross-field checks for duplicate identifiers, scene-kind requirements, approved image/still-presenter references, still-presenter provenance, generated-asset prompts, paired identity text and matching SHA-256 digest, cue chunk/token references, cue targets, and edge endpoints are enforced by productionManifestSchema at runtime. The bundled animated Claudia presenter uses no image reference. Asset provenance records declarations, not verified authenticity."
}
